Arena title,Capacity,About,Logo,Photo
"Toyota Center","18,043","<strong>Toyota Center</strong>&nbsp;is an indoor arena located in downtown Houston, Texas. It is named after the Japanese automobile manufacturer Toyota. The arena is home to the Houston Rockets of the National Basketball Association, the principal users of the building, and the former home of the Houston Aeros of the American Hockey League.

Rockets owner Leslie Alexander first began to request a new arena in 1995, and attempted to release the Rockets from their lease at The Summit, which ran until 2003. However, he was denied by arena owner Chuck Watson, then-owner of the Aeros, who also wanted control of a new arena. The two sides agreed to equal control over an arena in a deal signed in 1997, but the proposal was rejected by city voters in a 1999 referendum. It was not until the city and the Rockets signed an amended agreement in 2001, excluding the Aeros, that the proposal was accepted.

<p>Construction began in July 2001, and the new arena was officially opened in October 2003. The total costs were $235 million, with the city of Houston paying the majority, and the Rockets paying for enhancements. Toyota paid $100 million for the naming rights.</p>
","nba_images/arenas/toyota_center_logo.png","nba_images/arenas/toyota_center_photo.jpg"
"United Center","20,500","<strong>United Center</strong>&nbsp;is an indoor sports arena located in the Near West Side neighborhood of Chicago, Illinois. The United Center is home to both the Chicago Bulls of the National Basketball Association (NBA) and the Chicago Blackhawks of the National Hockey League (NHL). The arena is named after its city-based corporate sponsor, United Airlines.
<p></p>
<p>The plan to build the arena was created by then Blackhawks owner Bill Wirtz and Bulls owner Jerry Reinsdorf. The United Center&#39;s predecessor was the Chicago Stadium, the original &quot;Madhouse on Madison&quot;, which was demolished after the new arena opened for business on August 18, 1994. The first ever event at the United Center was the WWF event SummerSlam (1994). Due to the 1994&ndash;95 NHL lockout, the Blackhawks did not move in until January 1995.</p>

<p>The east side of the stadium features statues of Michael Jordan (known as &quot;The Spirit&quot;), Bobby Hull and Stan Mikita, while a statue of various Blackhawks sits to the north on Madison Street, where the Chicago Stadium was located.</p>

<p>Despite being merged with Continental Airlines in May 2010, the original United Airlines logo and United name still remain with the arena. United Airlines pays about $1.8 million per year until 2014 for its naming rights.</p>
","nba_images/arenas/united_center_logo.png","nba_images/arenas/united_center_photo.jpg"
"Verizon Center","18,277","<strong>Verizon Center</strong>, formerly known as the MCI Center, is a sports and entertainment arena in Washington, D.C.

Named after its sponsor, the telecommunications company Verizon Communications, the Verizon Center has been nicknamed the &quot;Phone Booth&quot; by local fans, because of its historical association with various telecommunications companies, such as MCI Inc. and Verizon. Located in the Chinatown neighborhood of Washington, D.C., the Verizon Center sits atop the Gallery Place rapid transit station of the Washington Metro.","nba_images/arenas/verision_center_logo.png","nba_images/arenas/verizon_center_photo.jpg"
"Vivint Smart Home Arena","19,911","<strong>Vivint Smart Home Arena</strong>&nbsp;is an indoor arena located in Salt Lake City, Utah, United States. The building is owned by Jazz Basketball Investors, Inc., the estate of Larry H. Miller. The arena is the home of the Utah Jazz of the National Basketball Association (NBA) and has been the home venue for other professional athletic teams such as the Utah Blaze of the Arena Football League and the Utah Starzz of the Women&#39;s National Basketball Association (WNBA). It seats 19,911 for basketball, has 56 luxury suites, and 668 club seats.

Opened in 1991, the arena was known as the Delta Center, under a naming rights deal with Delta Air Lines which has a hub at Salt Lake City International Airport. Salt Lake City-based EnergySolutions purchased the naming rights in November 2006, after Delta decided not to renew their 15-year contract due to filing for Chapter 11 bankruptcy the year prior. From 2006 to 2015 it was known as EnergySolutions Arena. On October 26, 2015, the arena was renamed as part of a 10-year naming rights contract with the Provo, Utah-based home security system provider Vivint.

The arena was also home to the figure skating and short track speed skating competitions of the 2002 Winter Olympics, where it was referred to as the Salt Lake Ice Center.
","nba_images/arenas/vivint_smart_home_arena_logo.jpg","nba_images/arenas/energy_solutions_arena_photo.jpg"
"Wells Fargo Center","19,500","<strong>The Wells Fargo Center</strong> (Spectrum II (prior to construction), formerly the CoreStates Center, First Union Center and Wachovia Center is a multi-purpose indoor arena located in Philadelphia, Pennsylvania. It is the home arena of the Philadelphia Flyers of the National Hockey League, the Philadelphia 76ers of the National Basketball Association, and the Philadelphia Soul of the Arena Football League. The Wells Fargo Center was completed in 1996 to replace the Spectrum as the home arena of the Flyers and 76ers, on the former site of John F. Kennedy Stadium (originally Philadelphia Municipal Stadium) at a cost of $210 million, largely privately financed (though the city and state helped to pay for the local infrastructure). It is owned by Comcast Spectacor, which also owns the Flyers, and is operated by its arena-management subsidiary, Global Spectrum.","nba_images/arenas/wells_fargo_center_logo.png","nba_images/arenas/wells_fargo_center_photo.jpg"
